{
  "$schema": "https://json-schema.org/draft/2020-12/schema",
  "title": "Statistic",
  "type": "object",
  "required": ["id", "label", "value", "unit", "description"],
  "properties": {
    "id": { "type": "string" },
    "label": { "type": "string" },
    "value": { "type": "number" },
    "unit": { "type": "string" },
    "description": { "type": "string" }
  },
  "additionalProperties": false
}
